{
  "$schema": "https://json-schema.org/draft/2020-12/schema",
  "$id": "https://raw.githubusercontent.com/omdsh-dev/dsh-accessibility/main/EVIDENCE-CATALOG.schema.json",
  "title": "DSH accessibility evidence scenario catalog",
  "description": "The versioned authority for claim-eligible and representative DSH accessibility tasks. It contains no participant data.",
  "type": "object",
  "additionalProperties": false,
  "required": ["$schema", "protocol", "catalogId", "reviewedOn", "scenarios"],
  "properties": {
    "$schema": { "type": "string", "maxLength": 200 },
    "protocol": { "const": "dsh-a11y-evidence-catalog/0.1.0-draft" },
    "catalogId": { "type": "string", "pattern": "^[a-z0-9][a-z0-9._-]{7,99}$" },
    "reviewedOn": { "type": "string", "format": "date" },
    "scenarios": {
      "type": "array",
      "minItems": 1,
      "maxItems": 30,
      "items": { "$ref": "#/$defs/scenario" }
    }
  },
  "$defs": {
    "scenario": {
      "type": "object",
      "additionalProperties": false,
      "required": ["protocol", "interface", "tasks"],
      "properties": {
        "protocol": {
          "type": "string",
          "pattern": "^[a-z0-9][a-z0-9.-]*/[0-9]+\\.[0-9]+\\.[0-9]+(-[a-z0-9.-]+)?$",
          "maxLength": 120
        },
        "interface": { "enum": ["web", "cli"] },
        "tasks": {
          "type": "array",
          "minItems": 1,
          "maxItems": 40,
          "items": { "$ref": "#/$defs/task" }
        }
      }
    },
    "task": {
      "type": "object",
      "additionalProperties": false,
      "required": ["id", "title", "description", "representativeCoreTask", "safetyCritical", "claimEligible"],
      "properties": {
        "id": { "type": "string", "pattern": "^[a-z0-9][a-z0-9._-]{1,79}$" },
        "title": { "type": "string", "minLength": 1, "maxLength": 120 },
        "description": { "type": "string", "minLength": 1, "maxLength": 500 },
        "representativeCoreTask": { "type": "boolean" },
        "safetyCritical": { "type": "boolean" },
        "claimEligible": { "type": "boolean" }
      },
      "allOf": [
        {
          "if": {
            "type": "object",
            "properties": { "representativeCoreTask": { "const": true } },
            "required": ["representativeCoreTask"]
          },
          "then": {
            "type": "object",
            "properties": { "claimEligible": { "const": true } }
          }
        },
        {
          "if": {
            "type": "object",
            "properties": { "safetyCritical": { "const": true } },
            "required": ["safetyCritical"]
          },
          "then": {
            "type": "object",
            "properties": { "claimEligible": { "const": true } }
          }
        }
      ]
    }
  }
}
